{
  "vendor": "Denon",
  "model": "MC7000",
  "description": "Denon DJ MC7000 4-deck Serato DJ Pro flagship controller. Mapping inferred from Denon MC7000 MIDI documentation + Serato default mapping. Decks A/B mapped for v2.0 (4-deck C/D semantic vocabulary deferred). Denon convention diverges from Pioneer: channel 0/1 per deck, EQ on CC 7/11/15 (vendor-accidental match with Pioneer), vol on CC 28. Hardware verification deferred.",
  "verified": false,
  "controls": {
    "vol_a":      {"type": "cc",   "channel": 0, "value": 28, "semantic": "vol_a",      "status": "tentative — needs hardware verification"},
    "vol_b":      {"type": "cc",   "channel": 1, "value": 28, "semantic": "vol_b",      "status": "tentative — needs hardware verification"},
    "eq_hi_a":    {"type": "cc",   "channel": 0, "value": 7,  "semantic": "eq_hi_a",    "status": "tentative — needs hardware verification"},
    "eq_hi_b":    {"type": "cc",   "channel": 1, "value": 7,  "semantic": "eq_hi_b",    "status": "tentative — needs hardware verification"},
    "eq_mid_a":   {"type": "cc",   "channel": 0, "value": 11, "semantic": "eq_mid_a",   "status": "tentative — needs hardware verification"},
    "eq_mid_b":   {"type": "cc",   "channel": 1, "value": 11, "semantic": "eq_mid_b",   "status": "tentative — needs hardware verification"},
    "eq_low_a":   {"type": "cc",   "channel": 0, "value": 15, "semantic": "eq_low_a",   "status": "tentative — needs hardware verification"},
    "eq_low_b":   {"type": "cc",   "channel": 1, "value": 15, "semantic": "eq_low_b",   "status": "tentative — needs hardware verification"},
    "tempo_a":    {"type": "cc",   "channel": 0, "value": 9,  "semantic": "tempo_a",    "status": "tentative — needs hardware verification"},
    "tempo_b":    {"type": "cc",   "channel": 1, "value": 9,  "semantic": "tempo_b",    "status": "tentative — needs hardware verification"},
    "filter_a":   {"type": "cc",   "channel": 0, "value": 26, "semantic": "filter_a",   "status": "tentative — needs hardware verification"},
    "filter_b":   {"type": "cc",   "channel": 1, "value": 26, "semantic": "filter_b",   "status": "tentative — needs hardware verification"},
    "xfader":     {"type": "cc",   "channel": 0, "value": 8,  "semantic": "xfader",     "status": "tentative — needs hardware verification"},
    "play_a":     {"type": "note", "channel": 0, "value": 0,  "semantic": "play_a",     "status": "tentative — needs hardware verification"},
    "play_b":     {"type": "note", "channel": 1, "value": 0,  "semantic": "play_b",     "status": "tentative — needs hardware verification"},
    "cue_a":      {"type": "note", "channel": 0, "value": 1,  "semantic": "cue_a",      "status": "tentative — needs hardware verification"},
    "cue_b":      {"type": "note", "channel": 1, "value": 1,  "semantic": "cue_b",      "status": "tentative — needs hardware verification"},
    "sync_a":     {"type": "note", "channel": 0, "value": 2,  "semantic": "sync_a",     "status": "tentative — needs hardware verification"},
    "sync_b":     {"type": "note", "channel": 1, "value": 2,  "semantic": "sync_b",     "status": "tentative — needs hardware verification"},
    "jog_a":      {"type": "note", "channel": 0, "value": 6,  "semantic": "jog_a",      "status": "tentative — needs hardware verification"},
    "jog_b":      {"type": "note", "channel": 1, "value": 6,  "semantic": "jog_b",      "status": "tentative — needs hardware verification"}
  }
}
