{
  "vendor": "Pioneer",
  "model": "DDJ-FLX4",
  "description": "Pioneer DDJ-FLX4 2-deck rekordbox/Serato/djay Pro controller. Ported from cohost_v4.py _CC_MAP + _NOTE_MAP — POC-grounded from real DJ sessions. Sync note disambiguated 2026-05-15 (Phase 27 MIDI-20) — POC source cohost_v4.py _NOTE_MAP confirms note 0x60 (96 dec) fires for sync on both decks; note 0x58 (88 dec) is Mixxx-canonical defensive retained as 'tentative' for users with Mixxx mapping. See tests/fixtures/ddj_flx4_sync_capture.jsonl for fixture provenance. EQ/fader/tempo/filter/xfader/play/cue/jog/loop verified by POC.",
  "verified": true,
  "controls": {
    "vol_a":      {"type": "cc",   "channel": 0, "value": 19,  "semantic": "vol_a",      "status": "verified"},
    "vol_b":      {"type": "cc",   "channel": 1, "value": 19,  "semantic": "vol_b",      "status": "verified"},
    "eq_hi_a":    {"type": "cc",   "channel": 0, "value": 7,   "semantic": "eq_hi_a",    "status": "verified"},
    "eq_hi_b":    {"type": "cc",   "channel": 1, "value": 7,   "semantic": "eq_hi_b",    "status": "verified"},
    "eq_mid_a":   {"type": "cc",   "channel": 0, "value": 11,  "semantic": "eq_mid_a",   "status": "verified"},
    "eq_mid_b":   {"type": "cc",   "channel": 1, "value": 11,  "semantic": "eq_mid_b",   "status": "verified"},
    "eq_low_a":   {"type": "cc",   "channel": 0, "value": 15,  "semantic": "eq_low_a",   "status": "verified"},
    "eq_low_b":   {"type": "cc",   "channel": 1, "value": 15,  "semantic": "eq_low_b",   "status": "verified"},
    "tempo_a":    {"type": "cc",   "channel": 0, "value": 0,   "semantic": "tempo_a",    "status": "verified"},
    "tempo_b":    {"type": "cc",   "channel": 1, "value": 0,   "semantic": "tempo_b",    "status": "verified"},
    "filter_a":   {"type": "cc",   "channel": 6, "value": 23,  "semantic": "filter_a",   "status": "verified"},
    "filter_b":   {"type": "cc",   "channel": 6, "value": 24,  "semantic": "filter_b",   "status": "verified"},
    "xfader":     {"type": "cc",   "channel": 6, "value": 31,  "semantic": "xfader",     "status": "verified"},
    "play_a":     {"type": "note", "channel": 0, "value": 11,  "semantic": "play_a",     "status": "verified"},
    "play_b":     {"type": "note", "channel": 1, "value": 11,  "semantic": "play_b",     "status": "verified"},
    "cue_a":      {"type": "note", "channel": 0, "value": 12,  "semantic": "cue_a",      "status": "verified"},
    "cue_b":      {"type": "note", "channel": 1, "value": 12,  "semantic": "cue_b",      "status": "verified"},
    "sync_a":     {"type": "note", "channel": 0, "value": 96,  "semantic": "sync_a",     "status": "verified"},
    "sync_b":     {"type": "note", "channel": 1, "value": 96,  "semantic": "sync_b",     "status": "verified"},
    "sync_a_alt": {"type": "note", "channel": 0, "value": 88,  "semantic": "sync_a_alt", "status": "tentative — needs hardware verification"},
    "sync_b_alt": {"type": "note", "channel": 1, "value": 88,  "semantic": "sync_b_alt", "status": "tentative — needs hardware verification"},
    "jog_a":      {"type": "note", "channel": 0, "value": 54,  "semantic": "jog_a",      "status": "verified"},
    "jog_b":      {"type": "note", "channel": 1, "value": 54,  "semantic": "jog_b",      "status": "verified"},
    "loop_in_a":  {"type": "note", "channel": 0, "value": 16,  "semantic": "loop_in_a",  "status": "verified"},
    "loop_in_b":  {"type": "note", "channel": 1, "value": 16,  "semantic": "loop_in_b",  "status": "verified"},
    "loop_out_a": {"type": "note", "channel": 0, "value": 17,  "semantic": "loop_out_a", "status": "verified"},
    "loop_out_b": {"type": "note", "channel": 1, "value": 17,  "semantic": "loop_out_b", "status": "verified"}
  }
}
